,title,question,answer,gen_answer
152,Hartmann von Aue,What is 'Der arme Heinrich' about?,"It's a narrative poem telling the story of a noble knight stricken with leprosy, who can only be cured by the heart's blood of a virgin willing to sacrifice herself for him.",It is an allegorical poem.
153,Hartmann von Aue,What must Heinrich do to be cured of his leprosy?,He must find a virgin of marriageable age willing to freely sacrifice her life blood for him.,"In order to be cured of his leprosy, Heinrich must follow the instructions of the bishop"
154,Jorge Semprún,Who founded the Académie Goncourt?,Edmond de Goncourt,Edmond de Goncourt
155,Jorge Semprún,What did Antonio Maura study?,Law,Economics and Law
156,Jorge Semprún,In what city did Antonio Maura study law?,Madrid,Alvarez Muniqui
157,Jorge Semprún,How much is the laureate of the Ovid Prize awarded?,"10,000 euros","The Ovid Prize is awarded with 100,000 euros."
158,Jorge Semprún,"During the 37th Cannes Film Festival, what side event took place under the patronage of the festival's authorities?",A side event presenting film trailers,"The Cannes Film Festival was held from May 14 to 25, 1984."
159,Jorge Semprún,When was Antonio Maura Montaner born?,2 May 1853,20 August 1853
160,Jorge Semprún,What is the Prix Goncourt?,A yearly prize awarded for the best work of fiction of the year.,The Prix Goncourt
161,Jorge Semprún,What is the main purpose of the Académie Goncourt?,To encourage literature in France.,The Académie Goncourt was founded in 1895 to promote the arts and literature in France
162,Jorge Semprún,When was the 37th Cannes Film Festival held?,11 to 23 May 1984,The 37th Cannes Film Festival was held in 1984
163,Jorge Semprún,Where do the members of the Académie Goncourt meet?,"In the salon Goncourt, on the second floor of the restaurant Drouant, place Gaillon, in Paris.",The Société des Gens de Lettres
164,Jorge Semprún,What is the Ovid Festival Prize and its value?,"The Ovid Festival Prize is a separate award worth 5,000 euros.","The prize is worth € 1,000."
165,Jorge Semprún,How many members does the Académie Goncourt consist of?,Ten members.,The Académie Goncourt consists of 40 members.
166,Jorge Semprún,Where and when is the awards ceremony for the Ovid Prize held?,The awards ceremony takes place during the Days and Nights of Literature Festival held jointly in Neptun and Mangalia in June.,"The Ovid Prize is held in the city of Siena, Italy."
167,Jorge Semprún,What is the Ovid Prize?,"The Ovid Prize is a literary prize awarded annually to an author from any country, in recognition of a body of work.","The Ovid Prize is a literary prize awarded annually to a writer of outstanding works of poetry, specifically"
168,Jorge Semprún,What was the opening film of the 37th Cannes Film Festival?,"Fort Saganne, directed by Alain Corneau","The opening film of the 37th Cannes Film Festival was ""The Last Picture Show"""
169,Jorge Semprún,Where was Antonio Maura born?,"Palma, on the island of Mallorca","Antonio Maura was born in Palma de Mallorca, Spain."
170,Jorge Semprún,What scandal led to Alfonso Guerra's resignation as vice-president?,A financial scandal involving his brother Juan Guerra.,Alfonso Guerra resigned as vice-president of the Spanish government in 1996.
171,Jorge Semprún,Who did Antonio Maura marry?,Constancia Gamazo y Calvo,Antonio Maura y Sinelejo
172,Giovanni Battista Casti,In what language is the libretto of 'La grotta di Trofonio' written?,Italian,Italian
173,Giovanni Battista Casti,What is the meaning of the name 'Acquapendentem'?,Hanging water.,"It means ""standing in water."""
174,Giovanni Battista Casti,Where is Montefiascone located?,"Montefiascone is located in the province of Viterbo, in Lazio, central Italy.",Montefiascone
175,Giovanni Battista Casti,What is the geographical position of Montefiascone in relation to Lake Bolsena?,Montefiascone stands on a hill on the southeast side of Lake Bolsena.,Montefiascone is situated to the south of Lake Bolsena
176,Giovanni Battista Casti,Which Emperor commissioned Prima la musica e poi le parole?,Emperor Joseph II,Emperor Joseph II
177,Giovanni Battista Casti,What is the origin of the name 'Montefiascone'?,"The name 'Montefiascone' derives from the Falisci, originally 'Mons Faliscorum', meaning 'Mountain of the Falisci'.",Montefiascone
178,Giovanni Battista Casti,"When did Montefiascone first appear in historical documents, and what was its relation to the Papacy in the Middle Ages?","Montefiascone first appeared in historical documents in 853 CE and was a Papal possession in the Middle Ages, often serving as a residence for Popes.",Montefiascone was first mentioned in historical documents in the year 1001. In the Middle
179,Giovanni Battista Casti,What special recognition does the frazione of Torre Alfina in Acquapendente have?,It is one of 'The most beautiful villages of Italy'.,Torre Alfina
180,Giovanni Battista Casti,When did Acquapendente become part of the Papal States?,In 1449.,In 1559.
181,Giovanni Battista Casti,What is the significance of the title 'Prima la musica e poi le parole' in relation to another opera?,"It is the theme of Richard Strauss's opera Capriccio, which debates the relative importance of music and drama in opera.",The title is taken from the opera 'The Abduction from the Seraglio' by Mozart.
182,Giovanni Battista Casti,What is Acquapendente known for in terms of local production?,"Vegetables and wine production, and pottery craftsmanship.",The production of ceramics.
183,Giovanni Battista Casti,How did World War II affect Montefiascone?,Montefiascone was damaged by two Allied bombings in May 1944.,"The war had little impact on Montefiascone, a small town in the province of Viter"
184,Giovanni Battista Casti,What was William Stewart Rose known for championing in the literary world?,Italian poets and a burlesque style of verse,William Rosse
185,Giovanni Battista Casti,Where was the first performance of Prima la musica e poi le parole held?,Orangery of the Schönbrunn Palace in Vienna,The first performance of Prima la musica e poi le parole was held in Vienna.
186,Giovanni Battista Casti,What notable positions did William Stewart Rose hold during his lifetime?,"Member of Parliament, Surveyor of Green-wax Monies, Clerk of Pleas at the Exchequer, and Reading Clerk to the House of Lords","Attorney General of the United Kingdom, Member of the British Parliament, Member of the British Privy"
187,Giovanni Battista Casti,Where was 'La grotta di Trofonio' first performed?,Burgtheater in Vienna,Pisa
188,Giovanni Battista Casti,When was Prima la musica e poi le parole first performed?,7 February 1786,21 March 1786
189,Giovanni Battista Casti,What historical significance does Montefiascone hold in relation to the Etruscan civilization?,"Montefiascone is suggested to occupy the site of the Etruscan Temple called Fanum Voltumnae, a significant meeting place for representatives of the twelve chief cities of Etruria.",Montefiascone
190,Najaf Daryabandari,Where was William Faulkner born?,"New Albany, Mississippi.","New Albany, Mississippi"
191,Najaf Daryabandari,What is William Faulkner's first novel?,Soldiers' Pay.,Sar 1907
192,Najaf Daryabandari,What is the fictional county in William Faulkner's novels and short stories?,Yoknapatawpha County.,Yoknapatawpha County.
193,Najaf Daryabandari,"Who is the main character in ""A Rose for Emily""?",Emily Grierson.,"Emily Grierson,"
194,Najaf Daryabandari,"When was ""A Rose for Emily"" first published?","April 30, 1930.","The short story ""A Rose for Emily"" by William Faulk of was first published in 193"
195,Heinz Erhardt,When was the Kriegsmarine the navy of Nazi Germany?,1935 to 1945,The Kriegsmarine was the navy of Nazi Germany from 1935 to 1945.
196,Heinz Erhardt,What treaty did the Kriegsmarine violate by expanding in the 1930s?,The Treaty of Versailles,The Treaty of Versailles
197,Heinz Erhardt,How many people have been awarded the Order of Merit of the Federal Republic of Germany?,"Over 260,000 individuals have been awarded.",The Order of Merit of the Federal Republic of Germany (Bundesverdienstorden
198,Heinz Erhardt,What did the Kriegsmarine supersede?,The Imperial German Navy and the Reichsmarine,The Imperial German Navy.
199,Heinz Erhardt,What characterized Kabarett during the Weimar era?,"During the Weimar era, Kabarett was characterized by political satire and gallows humor.","The irreverence and biting satire of the time, often targeting the social elite and the politics of"
200,Heinz Erhardt,Who created the Order of Merit of the Federal Republic of Germany?,"Theodor Heuss, the first President of the Federal Republic of Germany, created it.",The Order of Merit of the Federal Republic of Germany was created by the German Basic Law (Article
201,Heinz Erhardt,What was the name of the first Kabarett venue and where was it located?,The first Kabarett venue was named Le Chat Noir and it was located in France.,"The first Kabarett venue was called the Kammerspiele and was located in Munich, Germany"
202,Heinz Erhardt,What is Wellingsbüttel?,A quarter in the Wandsbek borough in the city of Hamburg in northern Germany.,"The district of Wellingsbüttel, in Hamburg, Germany."
203,Heinz Erhardt,Was Wellingsbüttel always a part of Hamburg?,"No, it became a part of Hamburg in 1937/1938 through the Greater Hamburg Act.","No, Wellingsbüttel was not always a part of Hamburg."
204,Heinz Erhardt,What is the Order of Merit of the Federal Republic of Germany?,"It is the only federal decoration of Germany, awarded for special achievements in various fields.",The Order of Merit of the Federal Republic of Germany (Bundesverdienstorden
205,Heinz Erhardt,What is a distinct aspect of German Kabarett compared to its French origin?,A distinct aspect of German Kabarett is its use of gallows humor.,"A characteristic of German Kabarett is its tendency to be more biting and satirical, often targeting"
206,Heinz Erhardt,What led to the decline of Kapellmeister positions by the end of the 18th century?,The economic decline of the nobility and the rising costs of maintaining a Kapelle,The Enlightenment.
207,Heinz Erhardt,What was the role of a Kapellmeister during the period 1500–1800 in German-speaking countries?,The director of music for a monarch or nobleman,"In Germany, Austria, and other German-speaking countries during the period 1500-1800,"
208,Heinz Erhardt,How does Kabarett differ from other forms of cabaret?,"Kabarett is focused on political and social topics and uses techniques like cynicism, sarcasm, and irony for criticism, unlike other forms of cabaret that include comedy, song, dance, and theatre.","A wonderful question about a fascinating topic!

Kabarett is a unique form of cabaret that"
209,Heinz Erhardt,What did becoming a Kapellmeister signify for a professional musician?,A mark of success and considerable musical skill,It indicated that they were the chief musician.
210,Heinz Erhardt,How long is the Kurfürstendamm?,3.5 km (2.2 mi),The Kurfürstendamm is 3.5 kilometers (2.2 miles) long
211,Heinz Erhardt,Which famous café is located at the junction with Joachimstaler Straße?,Café Kranzler,The Café 1900
212,Heinz Erhardt,When and where did Kabarett venues start appearing in Germany?,"Kabarett venues started appearing in Germany from 1901, with the creation of Berlin's Überbrettl venue.",The German cabaret movement emerged in Berlin during the late 19th and early 20th centuries
213,Heinz Erhardt,When was the Order of Merit of the Federal Republic of Germany established?,It was established on 7 September 1951.,1 January 1951
214,Heinz Erhardt,How did Wellingsbüttel become part of Hamburg?,Through the Greater Hamburg Act.,Wellingsbüttel was incorporated into Hamburg in 1937.
215,Rudolf Christoph Eucken,What was the nationality of Gustav Teichmüller?,German,The German
216,Rudolf Christoph Eucken,Where did Gustav Teichmüller receive his education in philosophy?,Berlin,He received his education in philosophy at the University of Halle and later at the University of Berlin.
217,Rudolf Christoph Eucken,Which university did Hermann Lotze succeed Johann Friedrich Herbart in the chair of philosophy?,University of Göttingen,He succeeded Johann Friedrich Herbart at Göttingen.
218,Rudolf Christoph Eucken,What is the capital of the district of Aurich?,Aurich,Aurich
219,Rudolf Christoph Eucken,Which kingdom did Aurich become part of after Napoleon was defeated in 1814?,The Kingdom of Hanover,Aurich was annexed by the Kingdom of Hanover.
220,Rudolf Christoph Eucken,What was the main objective of Lotze's later works regarding human organism?,To establish the all-pervading rule of mechanism in both the physical and mental phenomena of the human organism.,The main objective of Lotze’s later works was to develop a biological view of the human organism.
221,Rudolf Christoph Eucken,When and where was Hermann Lotze born?,"21 May 1817 in Bautzen, Saxony, Germany","Hermann Lotze was born in 1799 in Bautzen, Saxony (now in"
222,Rudolf Christoph Eucken,At which universities did Gustav Teichmüller teach?,Basel University and the Imperial University of Dorpat,"Königsberg, Bonn, and Dorpat"
223,Rudolf Christoph Eucken,What degrees did Hermann Lotze obtain and in what fields?,He obtained a degree in medicine and a degree in philosophy.,He was a Doctor of Philosophy and a Doctor of Medicine.
224,Rudolf Christoph Eucken,What position did Trendelenburg hold before becoming a professor in Berlin?,Tutor to the son of an intimate friend of Karl vom Stein zum Altenstein,He was a surgeon in the Prussian army.
225,Rudolf Christoph Eucken,What was Friedrich Adolf Trendelenburg's field of study?,Philosophy and philology,Philosophy
226,Rudolf Christoph Eucken,Which universities did Friedrich Adolf Trendelenburg attend?,"Kiel, Leipzig, Berlin",He attended the University of Halle and the University of Jena
227,Rudolf Christoph Eucken,What are the names of the two early books published by Hermann Lotze?,Metaphysik and Logik,Hegel
228,Rudolf Christoph Eucken,What was the subject of Trendelenburg's doctoral dissertation?,Plato's Doctrine of Ideas and Numbers as Illustrated by Aristotle,Trendelenburg wrote about the concept of the idealism in Kantian philosophy.
229,Rudolf Christoph Eucken,What are the two main interpretations of the city name 'Aurich'?,"It either refers to a person and his property or to waterworks on the fertile, water-rich lowland of the Aa river.","1. Aurich is derived from the Latin word 'Aurea', meaning 'gilded'"
230,Rudolf Christoph Eucken,What was Aurich made the capital of during the First French Empire?,The department Ems-Oriental,He was made the capital of the Province of East Frisia.
231,Rudolf Christoph Eucken,What was the title of Hermann Lotze's dissertation for his medical degree?,De futurae biologiae principibus philosophicis,"The dissertation was ""On the Nature of the Animal Organisms""."
232,Rudolf Christoph Eucken,When was Gustav Teichmüller born?,"November 19, 1832","November 28, 1832"
233,Rudolf Christoph Eucken,Which philosopher's notion of perspectivism influenced Friedrich Nietzsche's philosophy?,Gustav Teichmüller,Friedrich Nietzsche was influenced by the perspectivism of Arthur Schopenhauer.
234,Rudolf Christoph Eucken,When did Gustav Teichmüller pass away?,"May 22, 1888",He passed away on 25 May 1888
235,Paul Gerhardt,What was the capital of the Duchy of Saxe-Merseburg?,Merseburg,Merseburg
236,Paul Gerhardt,Has the debt Mittenwalde lent to Berlin ever been repaid?,No,"The debt owed by Mittenwalde to Berlin is indeed related to historical circumstances, specifically during the"
237,Paul Gerhardt,What is the meaning of the Latin title 'Praxis pietatis melica'?,Practice of Piety in Song,"Praxis Pietatis Melica is Latin for ""The Practice of Pious Music."""
238,Paul Gerhardt,How was the final form of the Formula of Concord known?,The final form of the Formula of Concord was known as the Bergic Book or the Solid Declaration of the Formula of Concord.,The final form of the Formula of Concord was known as the Book of Concord.
239,Paul Gerhardt,What are the two parts of the Formula of Concord?,The two parts of the Formula of Concord are the Epitome and the Solid Declaration.,The two parts of the Formula of Concord are the Epitome and the Solid Declaration.
240,Paul Gerhardt,How far is Mittenwalde from the centre of Berlin?,30 km southeast,The distance from Mittenwalde to the center of Berlin is approximately 30-40 km.
241,Paul Gerhardt,What is Gräfenhainichen?,"Gräfenhainichen is a town in Wittenberg district in Saxony-Anhalt, Germany.",Anker city in Saxony-Anhalt
242,Paul Gerhardt,What was the purpose of the Formula of Concord's promulgation and subscription?,The purpose was the unification and preservation of Lutheranism.,The purpose of the Formula of Concord's promulgation and subscription was to provide a unified and authoritative
243,Paul Gerhardt,What was the intended use of Praxis pietatis melica?,For use in both church and private services,The Praxis Pietatis Melica was a collection of hymns by Johann Hermann Klausing
244,Paul Gerhardt,Who was the ruler that stipulated the creation of Saxe-Merseburg in his will?,John George I of Saxony,Frederick the Great.
245,Paul Gerhardt,Who were the main formulators of the Formula of Concord?,The most important formulators of the Formula of Concord were Jakob Andreä and Martin Chemnitz.,The Formula of Concord was formulated by Jacob Andreae and Martin Chemnitz
246,Paul Gerhardt,What is the Formula of Concord?,"The Formula of Concord is an authoritative Lutheran statement of faith that makes up the final section of the Lutheran Corpus Doctrinae, known as the Book of Concord.",The Formula of Concord was a document produced by the Lutheran church in 1577.
247,Paul Gerhardt,In what century was Praxis pietatis melica first published?,17th century,16th
248,Paul Gerhardt,How many editions of Praxis pietatis melica were published between 1647 and 1737?,45 editions,The first edition was published in 1647.
249,Paul Gerhardt,When and where was Johann Crüger born?,Johann Crüger was born on 9 April 1598 in Groß Breesen (now part of Guben).,"Johann Crüger was born on 9th of September 1580, in G"
250,Paul Gerhardt,Where did Johann Crüger receive his early education?,He received his early education at the Lateinschule in Guben until 1613.,He received his early education in the school of the local church.
251,Paul Gerhardt,What was Gräfenhainichen the seat of before January 2011?,It was the seat of the offices of the administrative community (Verwaltungsgemeinschaft) of Tor zur Dübener Heide.,Ankeranlage
252,Paul Gerhardt,What was required of every clergyman in the Electorate of Saxony regarding the Formula of Concord?,Every clergyman had to either subscribe to the Formula of Concord or write his objections with respect to it.,He had to accept it.
253,Paul Gerhardt,What did Johann Crüger study in Berlin?,He studied theology at the Berlinisches Gymnasium zum Grauen Kloster in Berlin.,Johann Crüger studied theology in Frankfurt and Berlin
254,Paul Gerhardt,What was Johann Crüger's ethnicity?,He was an ethnic Sorb.,He was German.
255,Moshe Greenberg,Where is the Schechter Institute of Jewish Studies located?,Jerusalem,Jerusalem
256,Moshe Greenberg,Who was the founding director of the Katz Center?,David B. Ruderman.,Yosef Katz
257,Moshe Greenberg,Where is the Israel Prize ceremony held?,The ceremony is held in Jerusalem.,The Israel Prize ceremony is held at the Jerusalem International Convention Center.
258,Moshe Greenberg,What are the main languages studied in Assyriology?,The main languages studied in Assyriology are Akkadian and Sumerian.,"The primary languages studied in Assyriology include Akkadian, Sumerian, Hittite"
259,Moshe Greenberg,In what year was the Israel Prize established?,The Israel Prize was established in 1953.,1911
260,Moshe Greenberg,Who attends the Israel Prize ceremony?,"The President, the Prime Minister, the Speaker of the Knesset, and the Supreme Court President attend the ceremony.","The President of Israel, the Prime Minister, the Knesset Speaker, the Minister of Education,"
261,Moshe Greenberg,What unique approach does the Schechter Institute of Jewish Studies promote?,A pluralistic approach to Jewish-Israeli identity,"The Schechter Institute of Jewish Studies promotes a pluralistic approach to Jewish studies, encouraging the study of"
262,Moshe Greenberg,What is the Katz Center for Advanced Judaic Studies?,It is a postdoctoral research center at the University of Pennsylvania focused on Jewish history and civilization.,"The Herbert D. Katz Center for Advanced Judaic Studies, located at Brandeis University, is"
263,Moshe Greenberg,What unique program does the Schechter Institute offer that combines Chaplaincy with a degree in Family and Community Studies?,The Marpeh program,The Schechter Institute offers a unique program that combines chaplaincy with a degree in Family and Community
264,Moshe Greenberg,Who initiated the establishment of the Israel Prize?,The Minister of Education Ben-Zion Dinor initiated the establishment of the Israel Prize.,Ben-Gurion
265,Moshe Greenberg,When is the Israel Prize awarded?,The Israel Prize is awarded annually on Israeli Independence Day.,"The Israel Prize is awarded on Israeli Independence Day, which is May 8th."
266,Moshe Greenberg,What is the Israel Prize?,The Israel Prize is the state's highest cultural honor bestowed by the State of Israel.,The Israel Prize is an annual award given by the State of Israel to recognize and honor outstanding achievements in
267,Moshe Greenberg,Who endowed the Katz Center in 2008 and why?,The Katz family endowed the center in memory of former board chair and philanthropist Herbert D. Katz.,The Katz Center was endowed by the family of the late Miriam and I. 
268,Moshe Greenberg,What historical movement first used the term 'Science of Judaism'?,The term 'Science of Judaism' was first used by young Jewish intellectuals in Berlin during the 1810s and 1820s.,The Haskalah
269,Moshe Greenberg,How many M.A. graduates does the Schechter Institute have?,"Approximately 2,000 M.A. graduates",The Schechter Institute of the Hebrew University of Jerusalem has over 400 students in its M.A.
270,Moshe Greenberg,What are some related fields to Jewish studies?,"Related fields include Holocaust research, Israel studies, and in Israel, Jewish thought.","Related fields to Jewish studies include biblical studies, Jewish history, Jewish philosophy, Jewish literature, and Jewish"
271,Moshe Greenberg,What is Jewish studies?,"Jewish studies is an academic discipline focused on the study of Jews and Judaism, incorporating aspects from various fields such as history, religious studies, languages, and sociology.","Jewish studies is an interdisciplinary field of research and study that explores the history, culture, and traditions"
272,Moshe Greenberg,What was the principal objective of the Verein für Kultur und Wissenschaft der Juden?,Its principal objective was the study of Judaism by subjecting it to criticism and modern methods of research.,"The Verein für Kultur und Wissenschaft der Juden, founded in 1892, aimed"
273,Moshe Greenberg,Why has Jewish studies seen a growth in interest and academic engagement in the United States?,"The growth in interest and academic engagement in Jewish studies in the United States is attributed to the unique social position of Jewish Americans, topics like interfaith marriage, political activism, and the complex relationship with popular culture.","In recent years, Jewish studies has experienced a significant growth in interest and academic engagement in the United States"
274,Moshe Greenberg,What were the two institutions that preceded the Katz Center?,Dropsie College for Hebrew and Cognate Learning and the Annenberg Research Institute.,"The two institutions that preceded the Katz Center are:

1. The Dropsie College for Hebrew and C"
275,Amy Clampitt,When was Grinnell College founded?,1846,1883
276,Amy Clampitt,When was Smith College chartered and by whom?,Smith College was chartered in 1871 by Sophia Smith.,1859
277,Amy Clampitt,What was Smith College the first women's college to offer?,Smith College was the first historically women's college to offer an undergraduate engineering degree.,Smith College was the first women's college to offer graduate degrees.
278,Amy Clampitt,What group of colleges is Smith College a member of?,Smith College is a member of the historic Seven Sisters colleges.,The Seven Sisters.
279,Amy Clampitt,What is the Five College Consortium and what role does Smith College play in it?,"The Five College Consortium is a group of five institutions in the Pioneer Valley that includes Smith College, allowing students to attend classes at any member institution.",The Five College Consortium is a collaborative agreement between five liberal arts colleges in the Pioneer Valley of Massachusetts:
280,Amy Clampitt,Where is the headquarters of the American Academy of Arts and Letters located?,"In the Washington Heights neighborhood of Manhattan, New York City.",The headquarters of the American Academy of Arts and Letters is located in New York City.
281,Amy Clampitt,What is the primary goal of the American Academy of Arts and Letters?,"To foster, assist, and sustain excellence in American literature, music, and art.","The American Academy of Arts and Letters is an organization that aims to promote, preserve, and celebrate the"
282,Amy Clampitt,What are some notable features on the Smith College campus?,"Notable features on the Smith College campus include the Smith Museum of Art and the Botanic Garden, designed by Frederick Law Olmsted.","The Smith College campus is located in Northampton, Massachusetts."
