,title,question,answer,gen_answer
283,Amy Clampitt,What happened to much of New Providence's business district in 1910?,It burned in a fire.,"In 1910, a fire destroyed much of New Providence's business district."
284,Amy Clampitt,Are the memberships at the American Academy of Arts and Letters permanent?,"Yes, memberships are elected for lifetime appointments.","Membership at the American Academy of Arts and Letters is usually for life, but members can be removed for"
285,Amy Clampitt,What natural disaster struck New Providence in 1860?,a tornado,Hurricane.
286,Amy Clampitt,In which county is New Providence located?,Hardin County,"New Providence is located in Nassau County, Bahamas."
287,Amy Clampitt,How many members does the American Academy of Arts and Letters have?,300 members.,The Academy has 250 members.
288,Amy Clampitt,What types of exhibits does the American Academy of Arts and Letters showcase?,"Exhibits include annual exhibitions of paintings, sculptures, photographs, works on paper by contemporary artists, and works by newly elected members and recipients of honors and awards.","The American Academy of Arts and Letters showcases a variety of exhibits, including exhibitions of visual arts, literary"
289,Amy Clampitt,"What is the population of Lenox, Massachusetts as of the 2020 census?","5,095","14,  2,  4"
290,Amy Clampitt,"Which two villages are included within the town of Lenox, Massachusetts?",New Lenox and Lenoxdale,"Lenox, Massachusetts is comprised of two villages:

1. Lenox Village
2. New Len"
291,Amy Clampitt,What are the names of two major cultural institutions located in Lenox?,Shakespeare & Company and Tanglewood,The Clark Art Institute and the Tanglewood Music Center.
292,Amy Clampitt,What notable firsts occurred at Grinnell College in terms of sports?,The first intercollegiate football and baseball games west of the Mississippi were played there,The first women's intercollegiate athletic team in the United States was formed at Grinnell
293,Amy Clampitt,Which social movement was Grinnell College known as the center for?,The Social Gospel reform movement,The social movement of the Abolitionist movement.
294,Amy Clampitt,What is unique about Smith College's academic structure?,"Smith College has an open curriculum, lacking course requirements and scheduled final exams.",Smith College is one of the seven Sisters of the original Seven Sisters Colleges.
295,Ted Kooser,What is Kwame Dawes' current role at the University of Nebraska-Lincoln?,Professor of English,Kwame Dawes is the Distinguished Professor of English.
296,Ted Kooser,Which magazine does Kwame Dawes serve as editor-in-chief?,Prairie Schooner,"Kwame Dawes is the editor-in-chief of the magazine, New American Poet"
297,Ted Kooser,What genre does Edward Hirsch primarily write in?,Poetry,Poetry
298,Ted Kooser,What position does Edward Hirsch hold at the John Simon Guggenheim Memorial Foundation?,President,The President.
299,Ted Kooser,What is one of the major prizes a Copper Canyon Press poet won in 2020?,Jericho Brown won the 2020 Pulitzer Prize for Poetry for The Tradition,"In 2020, a Copper Canyon Press poet won the Pulitzer Prize for Poetry"
300,Ted Kooser,What award did Kwame Dawes receive from Poets & Writers in 2011?,Barnes & Noble Writers for Writers Award,Kwame Dawes received the 2011 Poets and Writers Magazine Award for AWP.
301,Ted Kooser,When was Edward Hirsch born?,"January 20, 1950",Edward Hirsch was born in 1950
302,Ted Kooser,What magazine did Warren Woessner co-found in 1968?,Abraxas Magazine,Warren Woessner co-founded Cricket Magazine in 1968
303,Ted Kooser,What professions is Kwame Dawes known for?,"Poet, actor, editor, critic, musician, and professor","Kwame Dawes is a Ghanaian poet, writer, and professor."
304,Ted Kooser,Can you name a bestseller by Edward Hirsch about reading poetry?,The document does not specify the title of the bestseller.,The bestseller by Edward Hirsch about reading poetry is 'How to Read a Poem and Fall
305,Ted Kooser,What types of works does Copper Canyon Press specialize in publishing?,"Poetry, including new collections, translations, re-issues of classics, prose books about poetry, and anthologies",Poetry.
306,Ted Kooser,What unique collection did Copper Canyon Press publish in 2016?,"Then Come Back: The Lost Neruda Poems, a collection of lost poems by Pablo Neruda",The Poets in the Piazza
307,Ted Kooser,What significant contribution did Greg Kuzma make in the 1970s?,"He founded the Best Cellar Press and the literary magazine, Pebble.",He was one of the first developers of the Nintendo Entertainment System.
308,Alfred Vogel,Who was Ben Black Elk's father?,Black Elk,Black Elk's father was Hehaka Sapa
309,Alfred Vogel,In what book did Ben Black Elk serve as an interpreter for his father's interviews?,Black Elk Speaks,Black Elk Speaks
310,Alfred Vogel,How many districts is Thurgau composed of?,5,The Thurgau District is composed of three districts.
311,Alfred Vogel,In which part of Switzerland is Thurgau located?,Eastern Switzerland,Thurgau is located in the north of Switzerland.
312,Alfred Vogel,Who acquired NRC Media group in 2015?,Mediahuis,P 21 Group
313,Alfred Vogel,What role is Ben Black Elk known as in relation to Mount Rushmore?,"the ""fifth face"" of Mount Rushmore",A member of the Oglala Lakota and a medicine man.
314,Alfred Vogel,What are the names of the two newspapers that merged to form NRC Handelsblad?,Algemeen Handelsblad and Nieuwe Rotterdamsche Courant,NRC Handelsblad was formed by the merger of the NRC (Nieuwe Rotterdam
315,Alfred Vogel,Where was 'Zondag met Lubach' recorded?,In the main auditorium of the Theater Bellevue in Amsterdam.,The talk show 'Zondag met Lubach' is recorded in the B  1 studio
316,Alfred Vogel,What is 'Zondag met Lubach'?,A Dutch weekly satirical television programme.,Zondag met Lubach is a Dutch satirical television program.
317,Alfred Vogel,Who presented 'Zondag met Lubach'?,Arjen Lubach.,Jandino 23
318,Alfred Vogel,What is the full former name of NRC?,NRC Handelsblad,National Radio Company
319,Alfred Vogel,What term is used to collectively refer to Appenzell Innerrhoden and Appenzell Ausserrhoden in political contexts?,beide Appenzell,Appenzell Innerrhoden and Appenzell Ausserrhoden
320,Alfred Vogel,What show succeeded 'Zondag met Lubach'?,De Avondshow met Arjen Lubach.,The show was replaced by 'Nieuwe Blik'.
321,Alfred Vogel,What significant event involving local peasants occurred in Thurgau in 1524?,"Local peasants occupied the cloister of Ittingen, driving out monks and destroying documents.",The peasant revolt of 1524-1525.
322,Alfred Vogel,What is the district name where Feusisberg is situated?,Höfe District,Zurich
323,Alfred Vogel,When did 'Zondag met Lubach' first air and when did it end?,It aired between 2014 and 2021.,The first episode of 'Zondag met Lubach' aired in 2012. It ended
324,Alfred Vogel,Who were the main scriptwriters for 'Zondag met Lubach'?,Tex de Wit and Pieter Jouke.,Paul Witteman
325,Alfred Vogel,When was NRC Handelsblad first published?,1 October 1970,1 September  1970
326,Alfred Vogel,What led to the division of Appenzell into Innerrhoden and Ausserrhoden?,The Swiss Reformation,The division of Appenzell into Innerrhoden and Ausserrhoden was caused by religious
327,Siegfried Lenz,During which world conflict was the Hansa utilized by Nazi Germany's Kriegsmarine?,World War II,The Kriegsmarine utilized the Hansa during World War II
328,Siegfried Lenz,When did the meetings of Group 47 end?,1967,The meetings ended in 1967.
329,Siegfried Lenz,What prestigious award did Martin Walser receive in 1981?,The Georg Büchner Prize,He received the award for the Georg Büchner Prize in 1981
330,Siegfried Lenz,How is a Fähnrich zur See formally addressed in the navy context?,Herr/Frau Fähnrich zur See,"A Fähnrich zur See is addressed as ""Fähnrich zur See"" (Mr"
331,Siegfried Lenz,What was the original purpose of the German auxiliary cruiser Hansa before it was converted?,It was originally conceived as the cargo ship Glengarry.,The Hansa was originally a passenger liner.
332,Siegfried Lenz,What is the NATO rank group equivalent for Fähnrich zur See?,OR-6,The NATO rank group equivalent for Fähnrich zur See is 3b.
333,Siegfried Lenz,After how many months of service can an officer candidate be promoted to Fähnrich zur See in the Deutsche Marine?,21 months,After 18 months
334,Siegfried Lenz,What was the fate of the Hansa after being de-commissioned as a Hilfskreuzer in February 1944?,The ship became a Kadettenschulschiff (cadet training ship).,"Hansa was converted into a floating anti-ship battery and served in the Baltic Sea, firing at"
335,Siegfried Lenz,What was the main purpose of Group 47's meetings?,"Literary criticism and promotion of young, unknown authors.","The meetings of Group 47 were meant to encourage young German writers, provide them with a supportive environment"
336,Siegfried Lenz,What significant role did Group 47 play in post-World War II Germany?,It offered a platform for the renewal of German literature after World War II and the end of censorship in Nazi Germany.,Group 47 was a literary group formed in 1947 in the aftermath of the Second World War
337,Siegfried Lenz,How was the Treaty of Warsaw (1970) viewed by the conservative opposition in West Germany?,As a betrayal of national interests.,The Treaty of Warsaw was viewed as a betrayal of the German people.
338,Siegfried Lenz,"When did Dieter Hildebrandt die, and what was revealed just days before his death?","He died on 20 November 2013, and it was revealed just days before that he had cancer.",Dieter Hildebrandt died on 27th August 2021.
339,Siegfried Lenz,Why was the Hansa not given a raider letter by the Royal Navy?,Because she did not enter active service as a commerce raider.,"The Hansa was given letters of marque, not a raider letter."
340,Siegfried Lenz,What controversy did Martin Walser cause in his acceptance speech for the Peace Prize of the German Book Trade?,He criticised the 'monumentalization of shame' in remembrance of the Holocaust.,He caused controversy with his speech by comparing Germany's guilt for the Holocaust to the guilt felt by someone
341,Siegfried Lenz,What significant role did the Hansa serve from September 1944 to May 1945?,"Participated in the Baltic Sea evacuations, transporting over 12,000 soldiers and civilians.",Hansa-Bund.
342,Siegfried Lenz,What significant event in Dieter Hildebrandt's life happened in 1944?,He was admitted to the Nazi Party on 20 April 1944.,"In 1944, Dieter Hildebrandt was imprisoned in the Buchenwald concentration camp"
343,Siegfried Lenz,What did the Treaty of Warsaw (1970) commit both sides to?,Nonviolence and acceptance of the existing border—the Oder-Neisse line.,The Treaty of Warsaw was signed between Poland and Germany on  10 July 1970.
344,Siegfried Lenz,Why was the Treaty of Warsaw significant from the Polish perspective?,"It was considered a compensation for the former Polish territory east of the Curzon Line, annexed by the Soviet Union in 1939.",It marked the end of the First Partition of Poland.
345,Siegfried Lenz,What countries were involved in the Treaty of Warsaw (1970)?,The Federal Republic of Germany (West Germany) and the People's Republic of Poland.,"Poland, West Germany, and the United Kingdom."
346,Siegfried Lenz,What does 'Fähnrich zur See' designate in the German Navy?,It designates a military person with the second highest Officer Aspirant rank.,Fähnrich zur See is the first officer rank in the German Navy.
347,"Philip Stanhope, 5th Earl Stanhope",What position succeeded the Secretary to the Board of Control after its abolition?,Under-Secretary of State for India,The Secretary to the Board of Control was abolished in 1833.
348,"Philip Stanhope, 5th Earl Stanhope",What was the role of the Secretary to the Board of Control?,"Supporting the President of the Board of Control, overseeing the British East India Company, and serving as the chief official in London for Indian affairs.",The Secretary to the Board of Control was responsible for managing the day-to-day business of the Board of
349,"Philip Stanhope, 5th Earl Stanhope",What is the main purpose of the Royal Literary Fund?,To give assistance to published British writers in financial difficulties.,"The Royal Literary Fund (RLF) aims to provide financial assistance to authors and poets in need, particularly"
350,"Philip Stanhope, 5th Earl Stanhope","What was Robert Smith, 1st Baron Carrington's profession before he was raised to the peerage?","He was a banker, slave owner, and politician.","Robert Smith was a politician, and a Member of Parliament."
351,"Philip Stanhope, 5th Earl Stanhope",How long did Robert Smith serve in the House of Commons?,From 1779 to 1797.,Robert Smith served in the House of Commons for 13 years.
352,"Philip Stanhope, 5th Earl Stanhope",What significant event inspired the founding of the Royal Literary Fund?,"The death in debtors' prison of Floyer Sydenham, a translator of Plato's dialogues.","The Royal Literary Fund was founded in 1790, following a significant event involving a fire that destroyed"
353,"Philip Stanhope, 5th Earl Stanhope",During which years did the post of Secretary to the Board of Control have Joint Secretaries?,Part of 1834 and from 1835,1861-1876
354,"Philip Stanhope, 5th Earl Stanhope","Who were Robert Smith, 1st Baron Carrington's parents?","Abel Smith (1717–1788) and Mary (née Bird, 1724–1780).",George Smith and Margaret Smith
355,"Philip Stanhope, 5th Earl Stanhope",Who was the first Secretary to the Board of Control?,Charles William Rouse-Boughton,Thomas M. 
356,"Philip Stanhope, 5th Earl Stanhope",How does the Royal Literary Fund generate its current funds?,"Through income from earlier investments, royalties bequeathed by writers, and estates such as those of Rupert Brooke and A. A. Milne.",The Royal Literary Fund is funded through donations and bequests.
357,"Philip Stanhope, 5th Earl Stanhope",Can you name some of the established writers the Royal Literary Fund has helped?,"Samuel Taylor Coleridge, James Joyce, and Joseph Conrad among others.","The Royal Literary Fund has supported many writers, including Charles Dickens, Thomas De Quincey, and"
358,"Philip Stanhope, 5th Earl Stanhope",When was the position of Secretary to the Board of Control abolished?,1858,The position of Secretary to the Board of Control was abolished in 1947.
359,"Philip Stanhope, 5th Earl Stanhope",Who held the position of Secretary to the Board of Control just before it was abolished?,Henry Baillie,The position of Secretary to the Board of Control was held by Sir Charles P. Fitzgerald
360,"Philip Stanhope, 5th Earl Stanhope",When was the Royal Literary Fund founded?,1790,The Royal Literary Fund was founded in 1784.
361,"Philip Stanhope, 5th Earl Stanhope",What year was the Royal Literary Fund granted a royal charter?,1818,1911
362,"Philip Stanhope, 5th Earl Stanhope","When was Robert Smith, 1st Baron Carrington, born?",22 January 1752,14 November 1752
363,"Philip Stanhope, 5th Earl Stanhope","When and whom did Robert Smith, 1st Baron Carrington, marry as his first wife?",Anne Boldero-Barnard on 6 July 1780.,"Robert Smith, 1st Baron Carrington, married Margaret Ogle, the daughter of George O"
