,title,question,answer,idk,gen_answer
0,Benedetto Varchi,What nationality was Benedetto Varchi?,Italian,"I must confess, that's unknown to me.",Benedetto Varchi was an  Italian  human  istic  scholar
1,Benedetto Varchi,What professions did Benedetto Varchi have?,"Humanist, historian, poet",I can't say I'm familiar with that.,"Benedetto  V  urchi was a  poet,  a  historian,  and  a  2nd   3rd   4th   5th   6th   "
2,Benedetto Varchi,Where was Benedetto Varchi born?,Florence,My capabilities do not extend to that subject.,  8 November 1515
3,Benedetto Varchi,Who commissioned Benedetto Varchi to write a history of Florence?,Cosimo I,I'm not privy to that information.,"A 15th-century nobleman, and a group of 30 of the most prominent citizens of Florence"
4,Benedetto Varchi,When was Varchi's Storia fiorentina first published in Florence?,1721,I have no clue about that.,155  5
5,Benedetto Varchi,Which work of Ezra Pound mentions Benedetto Varchi?,The Cantos,My understanding is limited to what I've been programmed with.,  C  1
6,Benedetto Varchi,What was the main topic of Benedetto Varchi's Storia fiorentina?,The history of Florence from 1527 to 1538,I'm in the dark about that topic.,The    1st   1st   1st     1   1  1   1   1   1   1   1
7,Wilhelm Wattenbach,What nationality was Wilhelm Wattenbach?,German,I'm missing information on that.,German
8,Wilhelm Wattenbach,In which field did Wilhelm Wattenbach specialize?,History,That's a mystery to me as well.,History
9,Wilhelm Wattenbach,What position did Wilhelm Wattenbach hold at Berlin?,Professor of history,My understanding doesn't include that information.,He was a  professor at the  König  1
10,Elsa Triolet,In which country did Elsa Triolet settle after emigrating from Russia?,France,I'm at a disadvantage with that question.,In   193   1  1  1
11,Elsa Triolet,Who did Elsa Triolet meet in 1928 that she would later marry?,Louis Aragon,I'm at a loss for that one.,  3
12,Elsa Triolet,In which movement did Elsa Triolet participate during World War II?,French Resistance,That's outside my area of expertise.,The  2nd  International
13,Elsa Triolet,Which poet's work did Elsa Triolet first translate into French?,Vladimir Mayakovsky,"I apologize, but I don't know that.",S.  2
14,Elsa Triolet,What nationality did Elsa Triolet adopt after moving from Russia?,French,That's beyond my current knowledge base.,French
15,Theopompus,Where was Theopompus born?,Chios,I'm not certain about that.,  6
16,Theopompus,What significant career path did Isocrates advise Theopompus to pursue?,Historian,I'm unable to answer that question.,"A historian, focusing on the H    istory of  4"
17,Theopompus,Where did Theopompus take refuge after Alexander's death?,"Egypt, with Ptolemy",I'm not well-versed in that subject.,E  1
18,Theopompus,Who severely censured Philip for his behavior in Theopompus's writings?,Theopompus,"I wish I could say, but I really don't know.",Theopom 
19,Heinrich Ritter,Which major thinker influenced Heinrich August Ritter's thinking?,Friedrich Schleiermacher,I have no enlightenment on that subject.,F.  Schle  igriz
20,Heinrich Ritter,What was the focus of Heinrich August Ritter's work 'Abriss der philosophischen Logik' published in 1824?,Philosophical logic,I have no data on that query.,Philosophical logic
21,Heinrich Ritter,What was the subject of 'Die christliche Philosophie bis auf die neuesten Zeiten' by Heinrich August Ritter?,Christian philosophy,I'm not sure I can help with that.,'An Introduction to the  Philosophy of  1
22,Heinrich Ritter,What does 'Ueber das Böse und seine Folgen' by Heinrich August Ritter discuss?,Evil and its consequences,I've no knowledge to draw upon for that.,The history of philosophical views on evil
23,Adrienne Monnier,What professions did Adrienne Monnier pursue?,"Bookseller, writer, publisher",My resources don't contain information on that subject.,"Ad  bookstore  owner,  writer,  and  2nd  2nd  2nd"
24,Adrienne Monnier,What era is Adrienne Monnier known to have been an influential figure in?,1920s and 1930s,I've got no idea about that.,The 1920s and 1930s
25,Adrienne Monnier,Where was Adrienne Monnier born?,Paris,I have yet to be informed about that subject.,A 17th 19th
26,Adrienne Monnier,What notable English language bookstore was inspired by Adrienne Monnier?,Shakespeare and Company,I've come up short with an answer for you.,Sh  igerb  ouse
27,Ann Brashares,What is Ann Brashares known for?,The Sisterhood of the Traveling Pants series.,"I must admit, I don't know.",The  1
28,Ann Brashares,What genre does Ann Brashares primarily write in?,Young adult,"Sorry, I am unable to answer that.",Young  adult
29,Ann Brashares,Where does Ann Brashares reside?,New York City,That's a topic I am not acquainted with.,  New  2
30,Hartmann von Aue,What was Hartmann von Aue's nationality?,German,I'm lacking information on that topic.,Hartmann  was  a  12th  12th  12th  12th
31,Hartmann von Aue,Name one of Hartmann von Aue's works.,Erec,I don't hold the knowledge you're seeking.,  1 E 
32,Hartmann von Aue,In which crusade did Hartmann von Aue participate?,The Crusade of 1197,I'm afraid I can't provide an answer to that.,In   1  2  3  4   5   6   7   8   9                
33,Hartmann von Aue,What was Hartmann von Aue's profession aside from being a poet?,Knight,I'm unable to provide an answer to that.,  A   1  1   1
34,Hartmann von Aue,What was the societal rank of Hartmann von Aue?,Lower nobility,My knowledge doesn't cover that area.,A member of the  2nd  nobility
35,Jorge Semprún,When was Jorge Semprún Maura born?,10 December 1923,I haven't been briefed on that topic.,    1 December  1923
36,Jorge Semprún,In what country was Jorge Semprún Maura born?,Spain,I don't have that information.,Spain
37,Jorge Semprún,What role did Jorge Semprún Maura hold in Spain's government after the dictatorship of Francisco Franco?,Minister of Culture,I'm unaware of that detail.,Jorge Sempr    ̃                                         
38,Jorge Semprún,What is the name of the concentration camp where Jorge Semprún was deported during World War II?,Buchenwald,I lack the specifics on that matter.,  1
39,Jorge Semprún,Where did Jorge Semprún live most of his life?,France,"That's a good question, but I don't have the answer.",France
40,Jorge Semprún,In what language did Jorge Semprún primarily write?,French,I've not been educated on that topic.,French
41,Giovanni Battista Casti,What nationality was Giovanni Battista Casti?,Italian,That's not information I've been programmed to know.,Italian
42,Giovanni Battista Casti,What type of studies did Giovanni Battista Casti pursue before entering priesthood?,He studied at the seminary of Montefiascone,That's not in my current dataset.,Theology
43,Giovanni Battista Casti,What position did Giovanni Battista Casti hold in his native place?,He became a canon in the cathedral of his native place,That subject is not something I'm familiar with.,"Not specified, but he was a 18th  1st  Lord  1st"
44,Giovanni Battista Casti,Name an opera libretto written by Giovanni Battista Casti with music by Antonio Salieri in 1785.,La grotta di Trofonio,I haven't learned about that topic.,  1.  1
45,Najaf Daryabandari,Which languages did Najaf Daryabandari translate works from and into?,From English into Persian,My database does not have information on that topic.,French
46,Najaf Daryabandari,Which Hemingway books did Najaf Daryabandari translate?,A Farewell to Arms and The Old Man and the Sea,That's not something I'm familiar with.,"A 3, 4, and 6-volume collection"
47,Najaf Daryabandari,What play by Samuel Beckett did Najaf Daryabandari translate?,Waiting for Godot,My training didn't cover that information.,I do not  have  information  on  the  play
48,Najaf Daryabandari,Which Sophocles' play did Najaf Daryabandari translate?,Antigone,I'm not the best source for that subject.,I do not have a specific information on the play.
49,Heinz Erhardt,What was Heinz Erhardt's nationality?,German,I can't provide any information on that topic.,E  1.
50,Heinz Erhardt,How many children did Heinz Erhardt have?,Four,I don't possess the information on that topic.,Two
51,Heinz Erhardt,What was the profession of Heinz Erhardt's grandson Marek Erhardt?,Actor,That hasn't been included in my training data.,A Swiss tennis player
52,Heinz Erhardt,During which war did Heinz Erhardt serve in the German navy?,World War II,That's a blind spot in my knowledge.,The 1st  World  War
53,Heinz Erhardt,Where did Heinz Erhardt move to in 1938?,Berlin,I regret to inform you that I don't have the answer.,Zurich
54,Rudolf Christoph Eucken,Which university did Rudolf Christoph Eucken receive his PhD from?,Göttingen University,I'm not able to provide an answer to that.,The University of  Tübingen
55,Rudolf Christoph Eucken,In what year did Rudolf Christoph Eucken win the Nobel Prize in Literature?,1908,That topic is out of my scope.,    190 8
56,Rudolf Christoph Eucken,What was the main reason Rudolf Christoph Eucken received the Nobel Prize?,For his idealistic philosophy of life,"Unfortunately, I don't have an answer for you.",The  190  Nobel  Prize  in  Literature
57,Rudolf Christoph Eucken,What position did Rudolf Christoph Eucken hold at the University of Basel?,Professor of Philosophy,I'm not informed on that matter.,  188  1  1  1  1  1   1   1   1   1   1   1   1   1
58,Rudolf Christoph Eucken,How many children did Rudolf Christoph Eucken have?,Three,That's an area I'm not acquainted with.,Three
59,Rudolf Christoph Eucken,Which city was Rudolf Christoph Eucken born in?,Aurich,My programming does not include that information.,  4 January 1845
60,Rudolf Christoph Eucken,What philosophy did Rudolf Christoph Eucken contribute to?,Ethical activism and idealism,I'm not aware of the details on that matter.,  1.
61,Paul Gerhardt,What nationality was Paul Gerhardt?,German,I lack insight into that question.,He  was  a  17  17  17
62,Paul Gerhardt,Who did Paul Gerhardt collaborate with on hymns in Berlin?,Johann Crüger,I lack the required information to answer that.,He  collaborated  with  Johann       He   eter
63,Paul Gerhardt,What was the fate of Paul Gerhardt's first child?,Died in infancy,I don't have the answer to that question.,The child died in 1661.
64,Paul Gerhardt,What is considered Paul Gerhardt's greatest contribution to German hymnody?,His hymns,"I'm sorry, that's not something I know about.",Hymns like      1
65,Paul Gerhardt,What is the title of the English translation of Paul Gerhardt's hymns?,Paul Gerhardt's Spiritual Songs,I'm blank on that topic.,  2
66,Moshe Greenberg,What field was Moshe Greenberg a scholar in?,Bible,I seem to have no data on that.,Bibl 
67,Moshe Greenberg,Where did Moshe Greenberg serve as a professor emeritus?,Hebrew University of Jerusalem,I'm stumped on that one.,  1. The 1983 film '  1 0  '
68,Moshe Greenberg,What languages did Moshe Greenberg grow up speaking at home?,Hebrew,I'm not sure.,Yiddish
69,Moshe Greenberg,Which university did Moshe Greenberg teach at from 1964-1970?,University of Pennsylvania,I'm not equipped to answer that.,  1
70,Amy Clampitt,What nationality was Amy Clampitt?,American,I don't hold any information on that matter.,American
71,Amy Clampitt,What was the name of Amy Clampitt's first published poem's venue in 1978?,The New Yorker,I'm drawing a blank on that one.,The  Po ets  Foundation Quarterly
72,Amy Clampitt,What type of cancer did Amy Clampitt die from?,Cancer,I'm not the right AI for that question.,"L  4-meth  5-oxo-1,4-"
73,Amy Clampitt,What was Amy Clampitt's first published poetry collection?,The Kingfisher,I haven't been trained on that topic.,  4  Poems
74,Amy Clampitt,Did Amy Clampitt publish any essays?,Yes,That's something I've yet to learn.,No
75,Ted Kooser,What prize did Theodore J. Kooser win in 2005?,Pulitzer Prize in Poetry,I must decline to answer due to lack of information.,"P  1,  1"
76,Ted Kooser,How long did Theodore J. Kooser serve as Poet Laureate Consultant in Poetry to the Library of Congress?,2004 to 2006,I've no insight into that matter.,                                                  
77,Ted Kooser,Which university did Theodore J. Kooser attend for his undergraduate education?,Iowa State University,That's not something I'm equipped to answer.,  196 
78,Ted Kooser,What book by Theodore J. Kooser won the 2005 Pulitzer Prize for Poetry?,Delights & Shadows,I'm unable to access any information on that.,                                                  
79,Alfred Vogel,What was Alfred Vogel's profession?,"Herbalist, naturopath, and writer",I haven't the faintest on that subject.,Al  was a Swiss  and  healer
80,Alfred Vogel,What is the name of Alfred Vogel's flagship product created from Echinacea purpurea?,Echinaforce,That's something I need to look up.,  8 or  8 (E  8
81,Alfred Vogel,What year did Alfred Vogel die?,1996,I have no knowledge on that subject.,   1.
82,Alfred Vogel,How old was Alfred Vogel at the time of his death?,93,I don't have any knowledge about that subject.,72
83,Alfred Vogel,What company named after Alfred Vogel is based in New Zealand?,Vogel's,That information is not within my reach.,V  4
84,Siegfried Lenz,Which prize did Siegfried Lenz receive in 2000?,The Goethe Prize,That's not in my field of knowledge.,The 2000  Go  (Gott  and  Berlin  (I  returned  to  Berlin  in  2000  as  a  resident  of  the  (Bau  (Bau  (B
85,Siegfried Lenz,What was Siegfried Lenz's profession?,Writer,I don't have any information on that matter.,He  was a  German  2B  writer
86,Siegfried Lenz,In which military branch did Siegfried Lenz serve during World War II?,The Kriegsmarine,I haven't encountered that in my training.,The 4th ( 1st Silesian 1st 2nd 3rd 4th 5th 6th 7th 8th 9 10  11  12  13  
87,Siegfried Lenz,What year did Siegfried Lenz join the Nazi Party?,1944,I'm not sure I can answer that.,17 July 1944
88,Siegfried Lenz,Which university did Siegfried Lenz attend?,University of Hamburg,"I'm sorry, that's not within my knowledge range.",The University of  Mün  eter
89,Siegfried Lenz,When did Siegfried Lenz die?,7 October 2014,I'm not knowledgeable about that topic.,10  1   202  1
90,Siegfried Lenz,What was the subject of the novel 'Der Überläufer' by Siegfried Lenz?,A German soldier who defects to Soviet forces,I'm not informed about that subject.,The novel  'Der   19        
91,Siegfried Lenz,What was Siegfried Lenz's role in the Group 47?,Member,That's something I'm not briefed on.,He was a member.
92,"Philip Stanhope, 5th Earl Stanhope","What year did Philip Henry Stanhope, 5th Earl Stanhope, help pass the Literary Copyright Act?",1842,I don't have the specifics you’re looking for.,1775
93,"Philip Stanhope, 5th Earl Stanhope","What role did Philip Henry Stanhope, 5th Earl Stanhope, serve in the Royal Literary Fund until his death?",President,That's uncharted territory for my knowledge base.,Treasurer
94,"Philip Stanhope, 5th Earl Stanhope","Which prize did Philip Henry Stanhope, 5th Earl Stanhope, found at Oxford in 1855?",The Stanhope essay prize,I'm clueless about that topic.,The 5th Earl Stanh  e Prize
95,"Philip Stanhope, 5th Earl Stanhope","What was the title of Philip Henry Stanhope, 5th Earl Stanhope's work about the War of the Spanish Succession?",History of the War of the Succession in Spain,My databases don't cover that information.,  1 June  1863
96,"Philip Stanhope, 5th Earl Stanhope","Who were Philip Henry Stanhope, 5th Earl Stanhope's parents?","Philip Stanhope, 4th Earl Stanhope, and the Hon. Catherine Stanhope",I have no familiarity with that topic.,  4  5
97,"Philip Stanhope, 5th Earl Stanhope","What narrative does 'The Forty-Five', a work by Philip Henry Stanhope, 5th Earl Stanhope, detail?",The Jacobite rising of 1745,I can't shed any light on that subject.,The Jacobite Rising of                                             
